{
  "id": "us-ma-cotuit-highlands",
  "name": "Cotuit Highlands",
  "continent": "North America",
  "country": "United States",
  "region": "MA",
  "type": "subordinate",
  "latitude": 41.6083,
  "longitude": -70.4367,
  "timezone": "America/New_York",
  "source": {
    "name": "US National Oceanic and Atmospheric Administration",
    "id": "8447675",
    "published_harmonics": true,
    "url": "https://tidesandcurrents.noaa.gov/stationhome.html?id=8447675",
    "source_url": "https://api.tidesandcurrents.noaa.gov/mdapi/prod/webapi/stations/8447675.json"
  },
  "license": {
    "type": "public domain",
    "commercial_use": true,
    "url": "https://tidesandcurrents.noaa.gov/disclaimers.html"
  },
  "offsets": {
    "reference": "us-ma-boston",
    "height": {
      "type": "ratio",
      "high": 0.26,
      "low": 0.26
    },
    "time": {
      "high": 77,
      "low": 47
    }
  }
}
