{
  "id": "us-shell-point-harkers-island",
  "name": "Shell Point, Harkers Island",
  "continent": "North America",
  "country": "United States",
  "region": "",
  "type": "subordinate",
  "latitude": 34.68333333333299,
  "longitude": -76.53333333333299,
  "timezone": "America/New_York",
  "source": {
    "name": "US National Oceanic and Atmospheric Administration",
    "id": "TEC2801",
    "published_harmonics": true,
    "url": "https://tidesandcurrents.noaa.gov/stationhome.html?id=TEC2801",
    "source_url": "https://api.tidesandcurrents.noaa.gov/mdapi/prod/webapi/stations/TEC2801.json"
  },
  "license": {
    "type": "public domain",
    "commercial_use": true,
    "url": "https://tidesandcurrents.noaa.gov/disclaimers.html"
  },
  "offsets": {
    "reference": "us-nc-cape-hatteras-fishing-pier",
    "height": {
      "type": "ratio",
      "high": 0.54,
      "low": 0.83
    },
    "time": {
      "high": 112,
      "low": 154
    }
  }
}
