{
  "id": "us-ak-auke-bay",
  "name": "Auke Bay",
  "continent": "North America",
  "country": "United States",
  "region": "AK",
  "type": "subordinate",
  "latitude": 58.3817,
  "longitude": -134.645,
  "timezone": "America/Juneau",
  "source": {
    "name": "US National Oceanic and Atmospheric Administration",
    "id": "9452263",
    "published_harmonics": true,
    "url": "https://tidesandcurrents.noaa.gov/stationhome.html?id=9452263",
    "source_url": "https://api.tidesandcurrents.noaa.gov/mdapi/prod/webapi/stations/9452263.json"
  },
  "license": {
    "type": "public domain",
    "commercial_use": true,
    "url": "https://tidesandcurrents.noaa.gov/disclaimers.html"
  },
  "offsets": {
    "reference": "us-ak-juneau",
    "height": {
      "type": "fixed",
      "high": -0.12,
      "low": 0
    },
    "time": {
      "high": -6,
      "low": -3
    }
  }
}
