{
  "id": "us-me-cape-porpoise",
  "name": "Cape Porpoise",
  "continent": "North America",
  "country": "United States",
  "region": "ME",
  "type": "subordinate",
  "latitude": 43.3667,
  "longitude": -70.4317,
  "timezone": "America/New_York",
  "source": {
    "name": "US National Oceanic and Atmospheric Administration",
    "id": "8418772",
    "published_harmonics": true,
    "url": "https://tidesandcurrents.noaa.gov/stationhome.html?id=8418772",
    "source_url": "https://api.tidesandcurrents.noaa.gov/mdapi/prod/webapi/stations/8418772.json"
  },
  "license": {
    "type": "public domain",
    "commercial_use": true,
    "url": "https://tidesandcurrents.noaa.gov/disclaimers.html"
  },
  "offsets": {
    "reference": "us-me-portland",
    "height": {
      "type": "ratio",
      "high": 0.95,
      "low": 0.95
    },
    "time": {
      "high": 12,
      "low": 14
    }
  }
}
