{
  "id": "us-fl-summerland-key-niles-channel-south",
  "name": "Summerland Key, Niles Channel South",
  "continent": "North America",
  "country": "United States",
  "region": "FL",
  "type": "subordinate",
  "latitude": 24.6517,
  "longitude": -81.435,
  "timezone": "America/New_York",
  "source": {
    "name": "US National Oceanic and Atmospheric Administration",
    "id": "8724266",
    "published_harmonics": true,
    "url": "https://tidesandcurrents.noaa.gov/stationhome.html?id=8724266",
    "source_url": "https://api.tidesandcurrents.noaa.gov/mdapi/prod/webapi/stations/8724266.json"
  },
  "license": {
    "type": "public domain",
    "commercial_use": true,
    "url": "https://tidesandcurrents.noaa.gov/disclaimers.html"
  },
  "offsets": {
    "reference": "us-fl-key-west",
    "height": {
      "type": "ratio",
      "high": 0.85,
      "low": 0.71
    },
    "time": {
      "high": -36,
      "low": 11
    }
  }
}
