{
  "id": "us-ca-bishop-cut-disappointment-slough",
  "name": "Bishop Cut, Disappointment Slough",
  "continent": "North America",
  "country": "United States",
  "region": "CA",
  "type": "subordinate",
  "latitude": 38.045,
  "longitude": -121.42,
  "timezone": "America/Los_Angeles",
  "source": {
    "name": "US National Oceanic and Atmospheric Administration",
    "id": "9415117",
    "published_harmonics": true,
    "url": "https://tidesandcurrents.noaa.gov/stationhome.html?id=9415117",
    "source_url": "https://api.tidesandcurrents.noaa.gov/mdapi/prod/webapi/stations/9415117.json"
  },
  "license": {
    "type": "public domain",
    "commercial_use": true,
    "url": "https://tidesandcurrents.noaa.gov/disclaimers.html"
  },
  "offsets": {
    "reference": "us-ca-port-chicago-suisun-bay",
    "height": {
      "type": "ratio",
      "high": 0.79,
      "low": 0.66
    },
    "time": {
      "high": 252,
      "low": 252
    }
  }
}
