{
  "id": "us-ak-raven-bay",
  "name": "Raven Bay",
  "continent": "North America",
  "country": "United States",
  "region": "AK",
  "type": "subordinate",
  "latitude": 53.475,
  "longitude": -166.873,
  "timezone": "America/Nome",
  "source": {
    "name": "US National Oceanic and Atmospheric Administration",
    "id": "9462573",
    "published_harmonics": true,
    "url": "https://tidesandcurrents.noaa.gov/stationhome.html?id=9462573",
    "source_url": "https://api.tidesandcurrents.noaa.gov/mdapi/prod/webapi/stations/9462573.json"
  },
  "license": {
    "type": "public domain",
    "commercial_use": true,
    "url": "https://tidesandcurrents.noaa.gov/disclaimers.html"
  },
  "offsets": {
    "reference": "us-ak-unalaska",
    "height": {
      "type": "ratio",
      "high": 1.49,
      "low": 1.27
    },
    "time": {
      "high": -196,
      "low": -228
    }
  }
}
