{
  "id": "us-fl-whiskey-creek-south-entrance-icww",
  "name": "Whiskey Creek, south entrance, ICWW",
  "continent": "North America",
  "country": "United States",
  "region": "FL",
  "type": "subordinate",
  "latitude": 26.055,
  "longitude": -80.1133,
  "timezone": "America/New_York",
  "source": {
    "name": "US National Oceanic and Atmospheric Administration",
    "id": "8722971",
    "published_harmonics": true,
    "url": "https://tidesandcurrents.noaa.gov/stationhome.html?id=8722971",
    "source_url": "https://api.tidesandcurrents.noaa.gov/mdapi/prod/webapi/stations/8722971.json"
  },
  "license": {
    "type": "public domain",
    "commercial_use": true,
    "url": "https://tidesandcurrents.noaa.gov/disclaimers.html"
  },
  "offsets": {
    "reference": "us-fl-government-cut-miami-harbor-entrance",
    "height": {
      "type": "ratio",
      "high": 0.96,
      "low": 1.14
    },
    "time": {
      "high": 4,
      "low": 31
    }
  }
}
