{
  "id": "us-ca-eureka-slough-bridge",
  "name": "Eureka Slough Bridge",
  "continent": "North America",
  "country": "United States",
  "region": "CA",
  "type": "subordinate",
  "latitude": 40.8067,
  "longitude": -124.142,
  "timezone": "America/Los_Angeles",
  "source": {
    "name": "US National Oceanic and Atmospheric Administration",
    "id": "9418802",
    "published_harmonics": true,
    "url": "https://tidesandcurrents.noaa.gov/stationhome.html?id=9418802",
    "source_url": "https://api.tidesandcurrents.noaa.gov/mdapi/prod/webapi/stations/9418802.json"
  },
  "license": {
    "type": "public domain",
    "commercial_use": true,
    "url": "https://tidesandcurrents.noaa.gov/disclaimers.html"
  },
  "offsets": {
    "reference": "us-ca-humboldt-bay-north-spit",
    "height": {
      "type": "ratio",
      "high": 1.08,
      "low": 1.02
    },
    "time": {
      "high": 33,
      "low": 19
    }
  }
}
