{
  "id": "us-ak-applegate-island",
  "name": "Applegate Island",
  "continent": "North America",
  "country": "United States",
  "region": "AK",
  "type": "subordinate",
  "latitude": 60.6233,
  "longitude": -148.165,
  "timezone": "America/Anchorage",
  "source": {
    "name": "US National Oceanic and Atmospheric Administration",
    "id": "9454794",
    "published_harmonics": true,
    "url": "https://tidesandcurrents.noaa.gov/stationhome.html?id=9454794",
    "source_url": "https://api.tidesandcurrents.noaa.gov/mdapi/prod/webapi/stations/9454794.json"
  },
  "license": {
    "type": "public domain",
    "commercial_use": true,
    "url": "https://tidesandcurrents.noaa.gov/disclaimers.html"
  },
  "offsets": {
    "reference": "us-ak-cordova",
    "height": {
      "type": "fixed",
      "high": -0.18,
      "low": 0
    },
    "time": {
      "high": -1,
      "low": 6
    }
  }
}
