{
  "id": "us-la-barataria-pass",
  "name": "Barataria Pass",
  "continent": "North America",
  "country": "United States",
  "region": "LA",
  "type": "subordinate",
  "latitude": 29.275,
  "longitude": -89.945,
  "timezone": "America/Chicago",
  "source": {
    "name": "US National Oceanic and Atmospheric Administration",
    "id": "8761687",
    "published_harmonics": true,
    "url": "https://tidesandcurrents.noaa.gov/stationhome.html?id=8761687",
    "source_url": "https://api.tidesandcurrents.noaa.gov/mdapi/prod/webapi/stations/8761687.json"
  },
  "license": {
    "type": "public domain",
    "commercial_use": true,
    "url": "https://tidesandcurrents.noaa.gov/disclaimers.html"
  },
  "offsets": {
    "reference": "us-la-east-point-grand-isle",
    "height": {
      "type": "ratio",
      "high": 1.13,
      "low": 1.13
    },
    "time": {
      "high": 60,
      "low": -10
    }
  }
}
