{
  "id": "us-fl-suwannee-salt-creek",
  "name": "Suwannee, Salt Creek",
  "continent": "North America",
  "country": "United States",
  "region": "FL",
  "type": "subordinate",
  "latitude": 29.3283,
  "longitude": -83.1517,
  "timezone": "America/New_York",
  "source": {
    "name": "US National Oceanic and Atmospheric Administration",
    "id": "8727577",
    "published_harmonics": true,
    "url": "https://tidesandcurrents.noaa.gov/stationhome.html?id=8727577",
    "source_url": "https://api.tidesandcurrents.noaa.gov/mdapi/prod/webapi/stations/8727577.json"
  },
  "license": {
    "type": "public domain",
    "commercial_use": true,
    "url": "https://tidesandcurrents.noaa.gov/disclaimers.html"
  },
  "offsets": {
    "reference": "us-fl-cedar-key",
    "height": {
      "type": "ratio",
      "high": 0.91,
      "low": 0.83
    },
    "time": {
      "high": -7,
      "low": 24
    }
  }
}
