{
  "id": "us-wa-devils-head-drayton-passage",
  "name": "Devils Head, Drayton Passage",
  "continent": "North America",
  "country": "United States",
  "region": "WA",
  "type": "subordinate",
  "latitude": 47.1667,
  "longitude": -122.763,
  "timezone": "America/Los_Angeles",
  "source": {
    "name": "US National Oceanic and Atmospheric Administration",
    "id": "9446671",
    "published_harmonics": true,
    "url": "https://tidesandcurrents.noaa.gov/stationhome.html?id=9446671",
    "source_url": "https://api.tidesandcurrents.noaa.gov/mdapi/prod/webapi/stations/9446671.json"
  },
  "license": {
    "type": "public domain",
    "commercial_use": true,
    "url": "https://tidesandcurrents.noaa.gov/disclaimers.html"
  },
  "offsets": {
    "reference": "us-wa-seattle-madison-st-elliott-bay",
    "height": {
      "type": "ratio",
      "high": 1.25,
      "low": 1.1
    },
    "time": {
      "high": 40,
      "low": 50
    }
  }
}
