{
  "id": "us-south-negril-point",
  "name": "South Negril Point",
  "continent": "North America",
  "country": "United States",
  "region": "",
  "type": "subordinate",
  "latitude": 18.3,
  "longitude": -78.4,
  "timezone": "America/Jamaica",
  "source": {
    "name": "US National Oceanic and Atmospheric Administration",
    "id": "TEC4701",
    "published_harmonics": true,
    "url": "https://tidesandcurrents.noaa.gov/stationhome.html?id=TEC4701",
    "source_url": "https://api.tidesandcurrents.noaa.gov/mdapi/prod/webapi/stations/TEC4701.json"
  },
  "license": {
    "type": "public domain",
    "commercial_use": true,
    "url": "https://tidesandcurrents.noaa.gov/disclaimers.html"
  },
  "offsets": {
    "reference": "us-tx-galveston-galveston-channel",
    "height": {
      "type": "ratio",
      "high": 1.21,
      "low": 1.21
    },
    "time": {
      "high": -167,
      "low": -167
    }
  }
}
