{
  "id": "us-ak-el-capitan-passage-dry-pass",
  "name": "El Capitan Passage, Dry Pass",
  "continent": "North America",
  "country": "United States",
  "region": "AK",
  "type": "reference",
  "latitude": 56.1633,
  "longitude": -133.413,
  "timezone": "America/Sitka",
  "source": {
    "name": "US National Oceanic and Atmospheric Administration",
    "id": "9450998",
    "published_harmonics": true,
    "url": "https://tidesandcurrents.noaa.gov/stationhome.html?id=9450998",
    "source_url": "https://api.tidesandcurrents.noaa.gov/mdapi/prod/webapi/stations/9450998.json"
  },
  "license": {
    "type": "public domain",
    "commercial_use": true,
    "url": "https://tidesandcurrents.noaa.gov/disclaimers.html"
  },
  "harmonic_constituents": [
    {
      "name": "M2",
      "description": "Principal lunar semidiurnal constituent",
      "amplitude": 1.352,
      "phase_UTC": 273,
      "phase_local": 12.1,
      "speed": 28.984104
    },
    {
      "name": "S2",
      "description": "Principal solar semidiurnal constituent",
      "amplitude": 0.463,
      "phase_UTC": 307,
      "phase_local": 37,
      "speed": 30
    },
    {
      "name": "N2",
      "description": "Larger lunar elliptic semidiurnal constituent",
      "amplitude": 0.29,
      "phase_UTC": 252.1,
      "phase_local": 356.1,
      "speed": 28.43973
    },
    {
      "name": "K1",
      "description": "Lunar diurnal constituent",
      "amplitude": 0.435,
      "phase_UTC": 261.3,
      "phase_local": 125.9,
      "speed": 15.041069
    },
    {
      "name": "M4",
      "description": "Shallow water overtides of principal lunar constituent",
      "amplitude": 0.007,
      "phase_UTC": 217.1,
      "phase_local": 55.4,
      "speed": 57.96821
    },
    {
      "name": "O1",
      "description": "Lunar diurnal constituent",
      "amplitude": 0.28,
      "phase_UTC": 248,
      "phase_local": 122.5,
      "speed": 13.943035
    },
    {
      "name": "M6",
      "description": "Shallow water overtides of principal lunar constituent",
      "amplitude": 0.01,
      "phase_UTC": 104.2,
      "phase_local": 41.7,
      "speed": 86.95232
    },
    {
      "name": "MK3",
      "description": "Shallow water terdiurnal",
      "amplitude": 0,
      "phase_UTC": 0,
      "phase_local": 0,
      "speed": 44.025173
    },
    {
      "name": "S4",
      "description": "Shallow water overtides of principal solar constituent",
      "amplitude": 0.001,
      "phase_UTC": 274.6,
      "phase_local": 94.6,
      "speed": 60
    },
    {
      "name": "MN4",
      "description": "Shallow water quarter diurnal constituent",
      "amplitude": 0,
      "phase_UTC": 0,
      "phase_local": 0,
      "speed": 57.423832
    },
    {
      "name": "NU2",
      "description": "Larger lunar evectional constituent",
      "amplitude": 0.056,
      "phase_UTC": 254.8,
      "phase_local": 358.2,
      "speed": 28.512583
    },
    {
      "name": "S6",
      "description": "Shallow water overtides of principal solar constituent",
      "amplitude": 0.001,
      "phase_UTC": 52.8,
      "phase_local": 322.8,
      "speed": 90
    },
    {
      "name": "MU2",
      "description": "Variational constituent",
      "amplitude": 0.032,
      "phase_UTC": 238.9,
      "phase_local": 347.2,
      "speed": 27.968208
    },
    {
      "name": "2N2",
      "description": "Lunar elliptical semidiurnal second-order constituent",
      "amplitude": 0.038,
      "phase_UTC": 231.2,
      "phase_local": 340.1,
      "speed": 27.895355
    },
    {
      "name": "OO1",
      "description": "Lunar diurnal",
      "amplitude": 0.012,
      "phase_UTC": 274.7,
      "phase_local": 129.4,
      "speed": 16.139101
    },
    {
      "name": "LAM2",
      "description": "Smaller lunar evectional constituent",
      "amplitude": 0.009,
      "phase_UTC": 288.8,
      "phase_local": 23.7,
      "speed": 29.455626
    },
    {
      "name": "S1",
      "description": "Solar diurnal constituent",
      "amplitude": 0,
      "phase_UTC": 0,
      "phase_local": 0,
      "speed": 15
    },
    {
      "name": "M1",
      "description": "Smaller lunar elliptic diurnal constituent",
      "amplitude": 0.02,
      "phase_UTC": 254.8,
      "phase_local": 124.3,
      "speed": 14.496694
    },
    {
      "name": "J1",
      "description": "Smaller lunar elliptic diurnal constituent",
      "amplitude": 0.022,
      "phase_UTC": 268,
      "phase_local": 127.7,
      "speed": 15.5854435
    },
    {
      "name": "MM",
      "description": "Lunar monthly constituent",
      "amplitude": 0,
      "phase_UTC": 0,
      "phase_local": 0,
      "speed": 0.5443747
    },
    {
      "name": "SSA",
      "description": "Solar semiannual constituent",
      "amplitude": 0.031,
      "phase_UTC": 161.1,
      "phase_local": 160.4,
      "speed": 0.0821373
    },
    {
      "name": "SA",
      "description": "Solar annual constituent",
      "amplitude": 0.115,
      "phase_UTC": 273.7,
      "phase_local": 273.3,
      "speed": 0.0410686
    },
    {
      "name": "MSF",
      "description": "Lunisolar synodic fortnightly constituent",
      "amplitude": 0,
      "phase_UTC": 0,
      "phase_local": 0,
      "speed": 1.0158958
    },
    {
      "name": "MF",
      "description": "Lunisolar fortnightly constituent",
      "amplitude": 0.027,
      "phase_UTC": 173,
      "phase_local": 163.1,
      "speed": 1.0980331
    },
    {
      "name": "RHO",
      "description": "Larger lunar evectional diurnal constituent",
      "amplitude": 0.011,
      "phase_UTC": 242.3,
      "phase_local": 121.1,
      "speed": 13.471515
    },
    {
      "name": "Q1",
      "description": "Larger lunar elliptic diurnal constituent",
      "amplitude": 0.054,
      "phase_UTC": 241.4,
      "phase_local": 120.8,
      "speed": 13.398661
    },
    {
      "name": "T2",
      "description": "Larger solar elliptic constituent",
      "amplitude": 0.027,
      "phase_UTC": 305.7,
      "phase_local": 36,
      "speed": 29.958933
    },
    {
      "name": "R2",
      "description": "Smaller solar elliptic constituent",
      "amplitude": 0.004,
      "phase_UTC": 308.4,
      "phase_local": 38,
      "speed": 30.041067
    },
    {
      "name": "2Q1",
      "description": "Larger elliptic diurnal",
      "amplitude": 0.007,
      "phase_UTC": 234.8,
      "phase_local": 119.1,
      "speed": 12.854286
    },
    {
      "name": "P1",
      "description": "Solar diurnal constituent",
      "amplitude": 0.144,
      "phase_UTC": 260.4,
      "phase_local": 125.7,
      "speed": 14.958931
    },
    {
      "name": "2SM2",
      "description": "Shallow water semidiurnal constituent",
      "amplitude": 0,
      "phase_UTC": 0,
      "phase_local": 0,
      "speed": 31.015896
    },
    {
      "name": "M3",
      "description": "Lunar terdiurnal constituent",
      "amplitude": 0,
      "phase_UTC": 0,
      "phase_local": 0,
      "speed": 43.47616
    },
    {
      "name": "L2",
      "description": "Smaller lunar elliptic semidiurnal constituent",
      "amplitude": 0.038,
      "phase_UTC": 293.9,
      "phase_local": 28.1,
      "speed": 29.528479
    },
    {
      "name": "2MK3",
      "description": "Shallow water terdiurnal constituent",
      "amplitude": 0,
      "phase_UTC": 0,
      "phase_local": 0,
      "speed": 42.92714
    },
    {
      "name": "K2",
      "description": "Lunisolar semidiurnal constituent",
      "amplitude": 0.126,
      "phase_UTC": 309.8,
      "phase_local": 39,
      "speed": 30.082138
    },
    {
      "name": "M8",
      "description": "Shallow water eighth diurnal constituent",
      "amplitude": 0.004,
      "phase_UTC": 223.8,
      "phase_local": 260.3,
      "speed": 115.93642
    },
    {
      "name": "MS4",
      "description": "Shallow water quarter diurnal constituent",
      "amplitude": 0,
      "phase_UTC": 0,
      "phase_local": 0,
      "speed": 58.984104
    }
  ],
  "datums": {
    "LAT": 0.19200015,
    "HAT": 5.953,
    "STND": 0,
    "MHHW": 4.885,
    "MHW": 4.634,
    "DTL": 3.095,
    "MTL": 3.182,
    "MSL": 3.177,
    "MLW": 1.73,
    "MLLW": 1.305,
    "GT": 3.58,
    "MN": 2.904,
    "DHQ": 0.251,
    "DLQ": 0.425,
    "HWI": 9.5,
    "LWI": 3.24
  },
  "disclaimers": ""
}
