{
  "id": "us-md-deep-landing-swan-creek",
  "name": "Deep Landing, Swan Creek",
  "continent": "North America",
  "country": "United States",
  "region": "MD",
  "type": "subordinate",
  "latitude": 39.145,
  "longitude": -76.26,
  "timezone": "America/New_York",
  "source": {
    "name": "US National Oceanic and Atmospheric Administration",
    "id": "8573211",
    "published_harmonics": true,
    "url": "https://tidesandcurrents.noaa.gov/stationhome.html?id=8573211",
    "source_url": "https://api.tidesandcurrents.noaa.gov/mdapi/prod/webapi/stations/8573211.json"
  },
  "license": {
    "type": "public domain",
    "commercial_use": true,
    "url": "https://tidesandcurrents.noaa.gov/disclaimers.html"
  },
  "offsets": {
    "reference": "us-md-baltimore-fort-mchenry",
    "height": {
      "type": "ratio",
      "high": 0.96,
      "low": 1.09
    },
    "time": {
      "high": 2,
      "low": -4
    }
  }
}
