{
  "id": "us-hi-waimea-bay",
  "name": "Waimea Bay",
  "continent": "North America",
  "country": "United States",
  "region": "HI",
  "type": "subordinate",
  "latitude": 21.9567,
  "longitude": -159.673,
  "timezone": "Pacific/Honolulu",
  "source": {
    "name": "US National Oceanic and Atmospheric Administration",
    "id": "1611401",
    "published_harmonics": true,
    "url": "https://tidesandcurrents.noaa.gov/stationhome.html?id=1611401",
    "source_url": "https://api.tidesandcurrents.noaa.gov/mdapi/prod/webapi/stations/1611401.json"
  },
  "license": {
    "type": "public domain",
    "commercial_use": true,
    "url": "https://tidesandcurrents.noaa.gov/disclaimers.html"
  },
  "offsets": {
    "reference": "us-hi-nawiliwili",
    "height": {
      "type": "ratio",
      "high": 0.86,
      "low": 0.91
    },
    "time": {
      "high": 7,
      "low": 18
    }
  }
}
