{
  "id": "us-md-piney-point-md",
  "name": "Piney Point, Md.",
  "continent": "North America",
  "country": "United States",
  "region": "MD",
  "type": "subordinate",
  "latitude": 38.1333333,
  "longitude": -76.5333333,
  "timezone": "America/New_York",
  "source": {
    "name": "US National Oceanic and Atmospheric Administration",
    "id": "8578240",
    "published_harmonics": true,
    "url": "https://tidesandcurrents.noaa.gov/stationhome.html?id=8578240",
    "source_url": "https://api.tidesandcurrents.noaa.gov/mdapi/prod/webapi/stations/8578240.json"
  },
  "license": {
    "type": "public domain",
    "commercial_use": true,
    "url": "https://tidesandcurrents.noaa.gov/disclaimers.html"
  },
  "offsets": {
    "reference": "us-dc-washington-washington-channel-d-c",
    "height": {
      "type": "ratio",
      "high": 0.51,
      "low": 0.6
    },
    "time": {
      "high": -354,
      "low": -436
    }
  }
}
