{
  "id": "us-nj-absecon-channel-state-route-87-bridge",
  "name": "Absecon Channel, State Route 87 bridge",
  "continent": "North America",
  "country": "United States",
  "region": "NJ",
  "type": "subordinate",
  "latitude": 39.385,
  "longitude": -74.425,
  "timezone": "America/New_York",
  "source": {
    "name": "US National Oceanic and Atmospheric Administration",
    "id": "8534638",
    "published_harmonics": true,
    "url": "https://tidesandcurrents.noaa.gov/stationhome.html?id=8534638",
    "source_url": "https://api.tidesandcurrents.noaa.gov/mdapi/prod/webapi/stations/8534638.json"
  },
  "license": {
    "type": "public domain",
    "commercial_use": true,
    "url": "https://tidesandcurrents.noaa.gov/disclaimers.html"
  },
  "offsets": {
    "reference": "us-nj-atlantic-city-ocean",
    "height": {
      "type": "ratio",
      "high": 0.96,
      "low": 1.13
    },
    "time": {
      "high": 38,
      "low": 26
    }
  }
}
